subject,topic,task,skills
English Language,Reading comprehension,Read the extract and infer the speaker's attitude.,"Inference, evidence, explanation"
English Language,Creative writing,Describe a stormy street using sensory detail.,"Imagery, structure, vocabulary"
English Language,Persuasive writing,Write a speech arguing for more library funding.,"Rhetoric, audience, purpose"
English Literature,Poetry,Compare how two poems present conflict.,"Comparison, methods, context"
English Literature,Shakespeare,Analyse how ambition is presented in Macbeth.,"Character, theme, quotation"
English Literature,19th Century texts,Explain how context shapes a character's choices.,"Context, evidence, interpretation"
English Literature,Essay writing,Write a thesis statement for a theme essay.,"Argument, structure, evidence"
